<?xml version="1.0" encoding="UTF-8"?>
<xs:schema xmlns:xs="http://www.w3.org/2001/XMLSchema">
  <xs:simpleType name="EdadType">
    <xs:restriction base="xs:integer">
      <xs:minInclusive value="0"/>
      <xs:maxInclusive value="120"/>
    </xs:restriction>
  </xs:simpleType>
  <xs:element name="empresa">
    <xs:complexType>
      <xs:sequence>
        <xs:element name="empleado" maxOccurs="unbounded">
          <xs:complexType>
            <xs:sequence>
              <xs:element name="nombre" type="xs:string"/>
              <xs:element name="apellido" type="xs:string"/>
              <xs:element name="edad" type="EdadType"/>
              <xs:element name="departamento" type="xs:string"/>
              <xs:element name="cargo" type="xs:string"/>
            </xs:sequence>
            <xs:attribute name="id" type="xs:string" use="required"/>
          </xs:complexType>
        </xs:element>
      </xs:sequence>
    </xs:complexType>
  </xs:element>
</xs:schema>